{
  "schemaVersion": 2,
  "id": "auth-r1",
  "module": "auth",
  "createdAt": "2026-09-15T09:38:19.033Z",
  "allowDocsAhead": false,
  "pages": {
    "login": {
      "spec": "v1.0",
      "prototypeRevision": 1,
      "alignedToSpec": "v1.0",
      "status": "aligned",
      "baselineCommit": "6d6adae6243f4d7ea5ce805628538f56b50cba2b",
      "implementationCommit": "a64460c8ce5f048ac4a210826a5d154907882b45",
      "changeRequest": {
        "kind": null,
        "id": null,
        "url": null,
        "headCommit": null,
        "mergeCommit": null
      }
    }
  }
}
